{
  "$schema": "../../../schemas/agent-profile.schema.json",
  "profile_id": "read-preview-caller",
  "version": "2026-09-02.v1",
  "audience": "caller",
  "standard_ids": ["agent.bootstrap", "mcp-server-architecture-v1", "platform.contracts", "agent-access.v0", "release-agent-adapters", "read-preview-staging-profile-v1"],
  "allowed_rule_ids": ["AGENT-BOOT-001", "SEC-BOUNDARY-001", "MCP-SERVER-BOUNDARY-001", "MCP-TRANSPORT-001", "MCP-CREDENTIAL-001", "MCP-MODULE-001", "MCP-ADMIN-BOUNDARY-001", "CONTRACT-SCHEMA-001", "STATUS-ENVELOPE-001", "AGENT-PROFILE-001", "AGENT-CONTEXT-001", "AGENT-RESOURCE-001", "RELEASE-ADAPTER-001", "RELEASE-ADAPTER-002", "READ-PREVIEW-PROFILE-001", "READ-PREVIEW-ISOLATION-001", "READ-PREVIEW-AUTH-001", "READ-PREVIEW-QUALIFICATION-001"],
  "context_scopes": ["bootstrap", "standards", "module_catalog", "release"],
  "allowed_module_ids": ["agent-access", "cargo", "container", "canada-final-mile-quote", "riskcustoms-ca", "freightcom-ltl"],
  "content_mode": "summary"
}
