{
  "$schema": "../../../schemas/agent-profile.schema.json",
  "profile_id": "module-developer",
  "version": "2026-08-21.v1",
  "audience": "developer",
  "standard_ids": ["agent.bootstrap", "platform.contracts", "module-runtime.v0", "agent-access.v0", "active-workstreams", "writable-module-control-plane-v1", "effective-rfc", "implementation-plan"],
  "allowed_rule_ids": ["AGENT-BOOT-001", "SEC-BOUNDARY-001", "CONTRACT-SCHEMA-001", "STATUS-ENVELOPE-001", "MOD-LIFE-001", "MOD-CAP-001", "MOD-TOOL-001", "MOD-MOUNT-001", "AGENT-PROFILE-001", "AGENT-CONTEXT-001", "AGENT-RESOURCE-001", "WORKSTREAM-001", "CONTROL-WRITE-001", "CONTROL-AUTH-001", "CONTROL-RELEASE-001", "RFC-CHANGE-001", "PLAN-TRACE-001"],
  "context_scopes": ["bootstrap", "standards", "module_catalog", "workstreams"],
  "allowed_module_ids": ["cargo", "container"],
  "content_mode": "full"
}
