{
  "$schema": "../../../schemas/agent-profile.schema.json",
  "profile_id": "module-reviewer",
  "version": "2026-08-25.v1",
  "audience": "reviewer",
  "standard_ids": [
    "agent.bootstrap",
    "platform.contracts",
    "readback-attempt-finalization-v1",
    "module-runtime.v0",
    "agent-access.v0",
    "active-workstreams",
    "writable-module-control-plane-v1",
    "admin-control-state-dto-v1",
    "effective-rfc",
    "implementation-plan",
    "business-mcp.v1"
  ],
  "allowed_rule_ids": [
    "AGENT-BOOT-001",
    "SEC-BOUNDARY-001",
    "CONTRACT-SCHEMA-001",
    "STATUS-ENVELOPE-001",
    "CONTROL-ATTEMPT-001",
    "CONTROL-FINALIZE-001",
    "CONTROL-RECOVERY-001",
    "MOD-LIFE-001",
    "MOD-CAP-001",
    "MOD-TOOL-001",
    "MOD-MOUNT-001",
    "AGENT-PROFILE-001",
    "AGENT-CONTEXT-001",
    "AGENT-RESOURCE-001",
    "WORKSTREAM-001",
    "CONTROL-WRITE-001",
    "CONTROL-AUTH-001",
    "CONTROL-RELEASE-001",
    "CONTROL-STATE-001",
    "CONTROL-STATE-002",
    "CONTROL-STATE-003",
    "RFC-CHANGE-001",
    "PLAN-TRACE-001",
    "BUSINESS-MCP-001",
    "BUSINESS-MCP-002",
    "BUSINESS-MCP-003"
  ],
  "context_scopes": [
    "bootstrap",
    "standards",
    "module_catalog",
    "workstreams"
  ],
  "allowed_module_ids": [
    "cargo",
    "container",
    "freightcom-ltl"
  ],
  "content_mode": "full"
}
